content,clean_content
"I loved this app for a long time, as it made learning fun, turning it into a low pressure game. But they've added more and more ""competitive"" features and things add pressure plus nags that get to a point of detracting from the fun (for me at least). if you do a lot, you get put in more ""competitive"" leagues, which is ok. but eventually the time required just to avoid demotion becomes excessive. Sometimes I wish I'd not renewed my subscription.",loved app long time made learning fun turning low pressure game theyve added competitive features things add pressure plus nags get point detracting fun least lot get put competitive leagues ok eventually time required avoid demotion becomes excessive sometimes wish id renewed subscription
"Fantastic language app. However, it's been realesding up lately. It's not allowing me to give the correct answers. Its very frustrating because it's onlynl accepting wrong answer and impose my hearts and cannot finish a game. Also, the Japanese audio has on the most part become so incomprehensible that I lose all my hearts.",fantastic language app however realesding lately allowing give correct answers frustrating onlynl accepting wrong answer impose hearts cannot finish game also japanese audio part become incomprehensible lose hearts
10/10 learning app. learning lots of good français,learning app learning lots good franais
LOVE IT VERY MUCH,love much
this app is educational add free and  too there is a paid version super do lingo it's trial was amazing,app educational add free paid version super lingo trial amazing
I had a good experience.... worderful and amazement,good experience worderful amazement
i hope it's the most best app where i learn a language very good.,hope best app learn language good
Great app,great app
"maybe it's a good option to learn English but It became bad when they added things related to sexual tensions, which is not appropriate for the international community.",maybe good option learn english became bad added things related sexual tensions appropriate international community
"great app to study languages and music, math I choose music it's very fun",great app study languages music math choose music fun
"Amazing app, i learned so much",amazing app learned much
simply stunning and what makes me enjoy it more is their continuous improvement,simply stunning makes enjoy continuous improvement
funny learning,funny learning
very good app,good app
nice ap to learn lang,nice ap learn lang
i didnt like this app because when i given a wrong answer its start asking me to come back and start from first and its to longer,didnt like app given wrong answer start asking come back start first longer
"I only want my 12-year-old daughter to learn English, not ""gay"" concepts like this App is introducing in Lesson 5, unit 14. ""Talk about relationship.""",want yearold daughter learn english gay concepts like app introducing lesson unit talk relationship
really fun to learn Japanese,really fun learn japanese
very good English learning app i like it so much ,good english learning app like much
Great work helped m,great work helped
good app,good app
"Duolingo, You failed, I hate that app because it says ""Take 3 mins or 5 mins"" to learn a lesson also I tried to sleep without muting It says ""Last Chance"" and sound to without muting please be Careful.",duolingo failed hate app says take mins mins learn lesson also tried sleep without muting says last chance sound without muting please careful
"the apps great, quite interactive if you have the pro version helps with retention",apps great quite interactive pro version helps retention
it really helped me with Spanish,really helped spanish
i enjoy learning in this app you should also do this guys,enjoy learning app also guys
this is platform is very good to learn English,platform good learn english
world best language learning tool,world best language learning tool
very nice language lerning app of all people,nice language lerning app people
"Had duo super for probably around 4 years. I'm not quite sure how I would have liked the app without it. sad to cancel, but will not support google through any in store purchases.",duo super probably around years im quite sure would liked app without sad cancel support google store purchases
good app,good app
ok but does not work sometimes. wont say certain words so cant learn to pronounce them,ok work sometimes wont say certain words cant learn pronounce
this app is so helpful ,app helpful
this is great app ever,great app ever
it's been very helpful in helping me learn Japanese,helpful helping learn japanese
let's me learn Spanish,lets learn spanish
best platform to learn basics of any region language ,best platform learn basics region language
I want refund! they will charge your card without realizing it your money is gone and I realized it went to Duolingo subscription they didn't ask me first if they are going to charge my card while in a timing that money I need to use is for the emergency. please! return my money back,want refund charge card without realizing money gone realized went duolingo subscription didnt ask first going charge card timing money need use emergency please return money back
"I've been a Super user for almost 3 years. Had to uninstall the app because it became unnecessarily hard. Only 16 users stay in the Diamond league, really? It's crazy because everyone wants to stay. And you have to either earn XP to stay in the league or you actually learn the language. Not to mention that developers removed Duo's best features like the community where you could ask questions to native speakers. It would've been much better for me to spend all this time in Busuu instead.",ive super user almost years uninstall app became unnecessarily hard users stay diamond league really crazy everyone wants stay either earn xp stay league actually learn language mention developers removed duos best features like community could ask questions native speakers wouldve much better spend time busuu instead
Nice app for language class       ,nice app language class
it's very nice I am learning French is good for me,nice learning french good
this is the best skills teacher,best skills teacher
the way they teach is fun and easy to remember,way teach fun easy remember
excitingly learning ,excitingly learning
the best app everrr,best app everrr
Duolingo is a best app in english learning help me,duolingo best app english learning help
It's an AWESOME EXPERIENCE! They have a wide range of languages to choose from! Duolingo is also veryy Cute who helps u throughout your journey!,awesome experience wide range languages choose duolingo also veryy cute helps u throughout journey
A fun way to learn or relearn Spanish!!,fun way learn relearn spanish
it's great ,great
it really helped me to learn,really helped learn
I love this app..It's the best teacher,love appits best teacher
Really a nice language learning app ,really nice language learning app
I learnt more than 6 languages through the Duolingo. Thank you Duolingo,learnt languages duolingo thank duolingo
"A great app for people struggling to learn languages very useful, duo made learning a language just like playing games I love this app",great app people struggling learn languages useful duo made learning language like playing games love app
it's app is so good,app good
educative app very helpful,educative app helpful
really very nice app,really nice app
helpful,helpful
nice app i loved it it's easy to learn more languages ,nice app loved easy learn languages
very simple,simple
"This App is really good! This App different than other Apps, I'm happy to study with Duolingo.",app really good app different apps im happy study duolingo
this is so good ,good
"all good,without ad",goodwithout ad
very good app and very useful.,good app useful
this app is very-very. good,app veryvery good
it teaches me good Chinese lesson,teaches good chinese lesson
i lovesuper duolingo because I'm really proving my Chinese soon we willbe getting in touch withthem,lovesuper duolingo im really proving chinese soon willbe getting touch withthem
don't have it installed but I love Duolingo But please add more hearts or more ways to get them,dont installed love duolingo please add hearts ways get
that good App,good app
"duolingo is the perfect app to learn any language you want , I highly recommend it,and while learning you also have a lot of fun!",duolingo perfect app learn language want highly recommend itand learning also lot fun
v nice application nd helping,v nice application nd helping
it's good but it is daily,good daily
Excellent app! I really enjoy learning Polish with it every morning. Only reason it isn't 5 stars is because the practice exercises for new words never changes. It's the same words I have had since beginning learning Polish and I've moved on a lot! I'd love to be able to review my new words.,excellent app really enjoy learning polish every morning reason isnt stars practice exercises new words never changes words since beginning learning polish ive moved lot id love able review new words
this app so nice because is teach mee all skils by english language,app nice teach mee skils english language
Great app,great app
its easy to use you dont need to spend money and im actually learning Spanish,easy use dont need spend money im actually learning spanish
to much good app but there are some languages missing like Urdu,much good app languages missing like urdu
very good the music and languages are really easy to study,good music languages really easy study
good app for languages ,good app languages
this app is good but u have to add for urdu speakers too,app good u add urdu speakers
the best app I'll rate it 5,best app ill rate
"I think,this is the best app for learning language i ever seen",thinkthis best app learning language ever seen
it is the best way of learning a language!!!!! i have learnt Italian for 18 days and i know lots of words!!! and no ads!!!,best way learning language learnt italian days know lots words ads
it's got worse. It feels like I'm not learning anything anymore.,got worse feels like im learning anything anymore
This is the app I recommend for language learning,app recommend language learning
very nice app I can learn French from duolingo,nice app learn french duolingo
Fun and easy to use! love it so far.,fun easy use love far
it is not for free and cant learn better,free cant learn better
Good opportunity for busy people,good opportunity busy people
"its a fantastic app with many many languages it,s a fun way of learning spanish",fantastic app many many languages fun way learning spanish
very nice app! perfect for learning other languages if you want to travel to other countries! highly recommended,nice app perfect learning languages want travel countries highly recommended
superb and easy way all,superb easy way
I have been using the app since month and found it easy to use and helped improve my language tht I'm poor in . No need of any guide n tutorial just pick your language. Perfect for beginners,using app since month found easy use helped improve language tht im poor need guide n tutorial pick language perfect beginners
I learned japaness in a day !!!,learned japaness day
"im sure im learning alot,its beautiful as a first timer to feel this confident",im sure im learning alotits beautiful first timer feel confident
it's helpful ,helpful
it does nag a bit and it would be nice to be able to go back for vocabulary,nag bit would nice able go back vocabulary
Am getting better thanks to duolingo,getting better thanks duolingo
Great,great
lightning bolts and very bright colors aren't improving the educational experience,lightning bolts bright colors arent improving educational experience
this app is really very very best I learn Korean from 2 months and I learned very much best Korean . I speak fluently in Korean language. Duolingo teach like enjoy and with a game type. duolingo is very helpful platform for everyone.,app really best learn korean months learned much best korean speak fluently korean language duolingo teach like enjoy game type duolingo helpful platform everyone
easy learning  ,easy learning
Best app;I learned so many languages from here I just love this,best appi learned many languages love
Such a good and nice app my English skill has improve,good nice app english skill improve
Duolingo is amazing  app you can learn more than 100 languages and I ts free.,duolingo amazing app learn languages ts free
a very helpful app and improve my vocabulary and helped me to make sentences in the class I really loved it ,helpful app improve vocabulary helped make sentences class really loved
l love this sap I could know many language ,l love sap could know many language
it so excellent and it so helpful too for us struggling with languages,excellent helpful us struggling languages
good app starts from easy,good app starts easy
Duolingo is such an excellent language app that will help you boost you grammar in all possible ways.,duolingo excellent language app help boost grammar possible ways
Really good.,really good
so fun and makes learning more interesting,fun makes learning interesting
this is the perfect place to get learn Korean and more language thank you Duolingo,perfect place get learn korean language thank duolingo
great I'm already learing so much on my 2nd day!What are u waiting for come join the crew,great im already learing much nd daywhat u waiting come join crew
Good quality and very helpful to learn languages,good quality helpful learn languages
it really cool and helpful,really cool helpful
Good I love it but the ads are annoing,good love ads annoing
Play a game and learn something new!,play game learn something new
I want to learn Thai language but it is not available this apps I really hate this please add the Thai language,want learn thai language available apps really hate please add thai language
i learn french and now am really good at it,learn french really good
a very good free learning app for a language ,good free learning app language
Can you add lessons for Bulgarian speakers it will be much more easier to learn new languages for us Bulgarians,add lessons bulgarian speakers much easier learn new languages us bulgarians
best way to learn English,best way learn english
excellent resource for learning a wide range of languages,excellent resource learning wide range languages
"One of the best app that I've ever used in my life. True to say, this app provides its user with the feeling of both playing games and learning new languages. Specially the process of learning languages is so much attractive and beginner friendly that even a child can start learning languages from 0 knowledge. ",one best app ive ever used life true say app provides user feeling playing games learning new languages specially process learning languages much attractive beginner friendly even child start learning languages knowledge
this is a very good app and this is to learn more things thank you,good app learn things thank
"it's so amazing and easy!!!it may appear a bit boring at first,bit as you reach the 2ndevel,it's mind blowing..I don't even need to practise extra,I just play here by routine!I love  it!!",amazing easyit may appear bit boring firstbit reach ndevelits mind blowingi dont even need practise extrai play routinei love
it's make it fun way I love it,make fun way love
best in the world 10/10,best world
love this app,love app
bhot acha,bhot acha
"3 days, camping, no service, its all gone. Every day, its all gone.",days camping service gone every day gone
it was so helpful,helpful
nice Chinese 4skill education app I love it,nice chinese skill education app love
"helps you to learn Japanese, Chinese, French and many more . It is amazing!",helps learn japanese chinese french many amazing
I love it so much,love much
I feel pleasure very much playing it.,feel pleasure much playing
it's really helpful ,really helpful
Great app to practice new languages.,great app practice new languages
this apps so awesome. beginning person it was so perfect,apps awesome beginning person perfect
good as every body says,good every body says
so good...bot persian?,goodbot persian
I need more language from India,need language india
"I tried learning Spanish for a club in school and showed some of the lessons to my teacher there who pointed out many mistakes. I'm a native German speaker and after that Spanish 'incident' I tried the German course to see how it looks there and was surprised by the amount of mistakes and useless things you learn in the first lessons. Plus, when you report the mistakes nothing happens which is pretty frustrating and you also don't really learn any grammar.",tried learning spanish club school showed lessons teacher pointed many mistakes im native german speaker spanish incident tried german course see looks surprised amount mistakes useless things learn first lessons plus report mistakes nothing happens pretty frustrating also dont really learn grammar
It is a best app but if could talk freely like ChatGPT in this app then it would be even more fun,best app could talk freely like chatgpt app would even fun
it's is good app for learning english and other languages to children,good app learning english languages children
so useful and enjoyable,useful enjoyable
"Totally rad, it's helping me learn German really fast, you should totally download it.:)",totally rad helping learn german really fast totally download
"Honestly this app was probably my favorite language learning app of all time. It's fun, it has memorable characters and stories, it even keeps up with trends and the media. But I have poured two and a half years of my life into this app and I couldn't say I'm anymore fluent then I was back in the 8th Grade when I was taking a Spanish class. With the new AI systems running everything it's practically impossible to learn a new language. I will miss you Duo, thank you.",honestly app probably favorite language learning app time fun memorable characters stories even keeps trends media poured two half years life app couldnt say im anymore fluent back th grade taking spanish class new ai systems running everything practically impossible learn new language miss duo thank
very good app for learning English,good app learning english
"endlessly learning the same pointless sentence ""we have a dog?"" ""yes we have a dog"" repeated for 3mintutes. is not learning....it's embarrassing! the ratio of play to learning is 99 to 1. as well as the endless prodding to buy power ups and extra time, the extra cynical thing I've noticed is that the match madness game, won't let you beat the timer when you get to the advanced level of match madness as the buttons you need appear too slowly.",endlessly learning pointless sentence dog yes dog repeated mintutes learningits embarrassing ratio play learning well endless prodding buy power ups extra time extra cynical thing ive noticed match madness game wont let beat timer get advanced level match madness buttons need appear slowly
"Terrible speech recognition. No way you're telling native speakers their pronunciation is incorrect. Also putting similar words like ""The"" and ""Tea"" in one word bank to make sure we have a bigger chance to make a mistake is quite pathetic.",terrible speech recognition way youre telling native speakers pronunciation incorrect also putting similar words like tea one word bank make sure bigger chance make mistake quite pathetic
very poor quality of questions and app,poor quality questions app
"it's great, but I have a terrible memory and don't want to speak with someone until I can confidently remember things. No idea how to get around this. But I am speaking more French than I ever have.",great terrible memory dont want speak someone confidently remember things idea get around speaking french ever
It's very good and this app is also helpful for learning English Thanks Duolingo ,good app also helpful learning english thanks duolingo
thankyou,thankyou
I love this app,love app
It is a good language learning app but it is a little bit hard,good language learning app little bit hard
"too much ads, very annoying even though all I want to do is study. come on",much ads annoying even though want study come
best application hai,best application hai
voice is not better it should be improve,voice better improve
it good ,good
this is the best app which I ever met supports to learn languages.,best app ever met supports learn languages
Amazing app. I have a request. please add sanskrit also in the language learning list. I can't find any other app. Your way of teaching is amazing so I think that you can make me learn this boring language in an amazing way.,amazing app request please add sanskrit also language learning list cant find app way teaching amazing think make learn boring language amazing way
there is no expressions there is just: oh no where is my passport.  it should be like this: oh no where is my passport!!! ,expressions oh passport like oh passport
"its the perfect app to learn a new language , and it has helped me so much. i give it 5 stars ,totally recomend",perfect app learn new language helped much give stars totally recomend
the best,best
ai first? really? im embarrassed for you,ai first really im embarrassed
it is the best app to learn any language for FREE!! just learn the language like a game and in some time you will be good at that language,best app learn language free learn language like game time good language
good thank so much,good thank much
"I'm leaning something new which I don't now this language only listen in my life but now I'm leaning this language, I really enjoining ,",im leaning something new dont language listen life im leaning language really enjoining
this app is very good  and my favourite app,app good favourite app
good app,good app
it's very fun and entertaining good for learning something new ,fun entertaining good learning something new
it's good for learning languages,good learning languages
good app,good app
best english learning app,best english learning app
me parfect toking english,parfect toking english
It is a good app for learn every Language ,good app learn every language
It's very important to my studied.,important studied
it is an amazing way of learning I highly recommend Duolingo it helped me so much,amazing way learning highly recommend duolingo helped much
It is so good I have learned 20 languages in one year thanks to this app ,good learned languages one year thanks app
it's good,good
app logged me out the other day and now an error keeps occurring when I log in and I have been unable to keep my 550 day streak because it wont let me in,app logged day error keeps occurring log unable keep day streak wont let
best learning app,best learning app
it doesn't have thai language to learn but it's perfect if u wanna learn other languages,doesnt thai language learn perfect u wanna learn languages
"I love the way Duolingo makes learning languages fun. You would be saying I don't have the time and all but once you get in, you don't know till you do how many rounds.",love way duolingo makes learning languages fun would saying dont time get dont know till many rounds
the beast teacher is this app,beast teacher app
it is so much fun and educational,much fun educational
the best I've learned so much!,best ive learned much
best language learning app ,best language learning app
best application to learn different languages,best application learn different languages
it is great but the super Duolingo ad is annoying,great super duolingo ad annoying
I'm addicted to this game.,im addicted game
It's very beautiful app,beautiful app
"AI is Bricking this app, will never use again.",ai bricking app never use
"better app , but vocab is limited...",better app vocab limited
"A great app, but the Hindi course is way too short and it's not enough at all! It would be nice to continue learning the language",great app hindi course way short enough would nice continue learning language
very good app and very useful ,good app useful
app is a very usable an very comfortable and a very nice aap,app usable comfortable nice aap
good  app,good app
game is so fun,game fun
wow that's nice game ,wow thats nice game
good app for english speaking and writing,good app english speaking writing
best app to learn any language,best app learn language
Best App for language learning,best app language learning
It is a very good app to learn languages.,good app learn languages
that was amazing,amazing
I am so happy ,happy
Duolingo has given me a platform to lern multiple languages as well as a training tool for other people,duolingo given platform lern multiple languages well training tool people
it is a best app to learn different languages . yo communicate with others ... who are in not your contury .....,best app learn different languages yo communicate others contury
AMAZING! I only wish that we could learn Aramaic on it,amazing wish could learn aramaic
"it's a nice app, I love it",nice app love
extremely great app for language learning,extremely great app language learning
Very nice i am so Happy,nice happy
it's a good platform for learning English easily ,good platform learning english easily
it is so good and it also improve my Hindi speaking oven speaking personality I'll see a great thanks to do lingo to teach me so well as it and bringing me to level 5 by thank you,good also improve hindi speaking oven speaking personality ill see great thanks lingo teach well bringing level thank
the best app to improve English and I am very happy that it is helping me to improve my English,best app improve english happy helping improve english
mast app he,mast app
